{"default_theme":"themes/default.css","description":"d","entry_overlay":"overlay.omni","files":[{"path":"overlay.omni","sha256":"0000000000000000000000000000000000000000000000000000000000000000"},{"path":"themes/default.css","sha256":"0000000000000000000000000000000000000000000000000000000000000000"}],"license":"MIT","name":"Sample","omni_min_version":"0.1.0","schema_version":1,"tags":["dark"],"version":"1.0.0"}